Title,Link,Snippet,Summary,Info,Processed,Query
AGRICULTURA ORGÁNICA: BASES TÉCNICAS,https://www.researchgate.net/profile/Laura-Tovar-5/publication/322255166_Agricultura_organica_Bases_Tecnicas/links/5bb50a14299bf13e605daa48/Agricultura-organica-Bases-Tecnicas.pdf,"… El crecimiento de la agricultura orgánica se concentra en los estados de Chiapas y Oaxaca, que son las entidades más pobres de país, con los Índices de Desarrollo Humano más …","LG Tovar, MÁG Cruz - researchgate.net","{'summary': 'LG Tovar, MÁG Cruz - researchgate.net'}",2022-03-18 02:28:13 UTC,mezcal poverty oaxaca
A Study of Ritual Music in a Traditional Ikoots Community: The Mayordomía for the Candelaria Virgin,https://www.bac-lac.gc.ca/eng/services/theses/Pages/item.aspx?idNumber=429724363,"… San Mateo del Mar is one of the lkoots communities located along the Pacific coast in southern Oaxaca, Mexico, between the … Mezcal is an alcoholic drink used during festivities, but it …",VS Pacheco - 2007 - bac-lac.gc.ca,{'summary': 'VS Pacheco - 2007 - bac-lac.gc.ca'},2022-03-18 02:28:13 UTC,mezcal poverty oaxaca
Tequila: A Global History,https://books.google.com/books?hl=es&lr=&id=3HDYBgAAQBAJ&oi=fnd&pg=PT7&dq=mezcal+poverty+oaxaca&ots=QmNDifMC9N&sig=l0QHTjt17HJewAC8fAcucf3Eizc,"… , but it was in the distilleries of Jalisco and Oaxaca that I really came to appreciate the subtle … fermented from agave plants vino de mezcal – mescal wine. Mezcal derives from metl, the …",I Williams - 2015 - books.google.com,"{'summary': 'I Williams - 2015 - books.google.com', 'authors': [{'name': 'I Williams', 'link': 'https://scholar.google.com/citations?user=leDXE4wAAAAJ&hl=es&oi=sra', 'serpapi_scholar_link': 'https://serpapi.com/search.json?author_id=leDXE4wAAAAJ&engine=google_scholar_author&hl=es', 'author_id': 'leDXE4wAAAAJ'}]}",2022-03-18 02:28:13 UTC,mezcal poverty oaxaca
11 The social costs of microfinance and over-indebtedness for women,https://books.google.com/books?hl=es&lr=&id=vbVuAQAAQBAJ&oi=fnd&pg=PA232&dq=mezcal+poverty+oaxaca&ots=0uMoIAcxPx&sig=_n8KbGdFyzPk4BaXAx-iITSY1dc,"… ; they also produce mezcal and seasonal handicraft work. … Even in social groups like the indigenous towns of Oaxaca, … because it is part of the customs in Oaxaca. If you need a glass of …","LA Salazar - Microfinance, Debt and Over-Indebtedness, 2013 - books.google.com","{'summary': 'LA Salazar - Microfinance, Debt and Over-Indebtedness, 2013 - books.google.com'}",2022-03-18 02:28:13 UTC,mezcal poverty oaxaca
The Collegian (2013-04-15),https://scholarworks.utrgv.edu/cgi/viewcontent.cgi?article=1139&context=collegian,"… During her performance of “Mezcalito” the Oaxaca-born singer danced with a bottle of mezcal atop her head, poured … She found out about Downs on her travels to Oaxaca. …",J Molina - 2013 - scholarworks.utrgv.edu,{'summary': 'J Molina - 2013 - scholarworks.utrgv.edu'},2022-03-18 02:28:13 UTC,mezcal poverty oaxaca
""" The Venerable Martyrs of Cajonos"": An 1890 painted history of Zapotec rebellion in 1700",https://search.proquest.com/openview/b8297dfd630402963252531bed62f170/1?pq-origsite=gscholar&cbl=18750&diss=y,"… Oaxaca. That effort, apparently, proved successful, for the cycle is cited frequently by the modern beatification committee, formed in Oaxaca … for native peoples living in Oaxaca in the late …",KK McIntyre - 1997 - search.proquest.com,{'summary': 'KK McIntyre - 1997 - search.proquest.com'},2022-03-18 02:28:13 UTC,mezcal poverty oaxaca
Tequila,http://food.origin-for-sustainability.org/2005/upload/Tequila%20Report%20TO%20BE%20TURNED%20IN_22may08.pdf,"… Mezcal is used as the common denominator for all agave distillates, even though “mezcal” (produced in Oaxaca and a number of states in southern Mexico) has been protected as an …","B Sarah, HS VAN DER MEULEN - 2008 - food.origin-for-sustainability.org","{'summary': 'B Sarah, HS VAN DER MEULEN - 2008 - food.origin-for-sustainability.org'}",2022-03-18 02:28:13 UTC,mezcal poverty oaxaca
Introduction: modèles alimentaires et recompositions sociales en Amérique Latine,https://journals.openedition.org/aof/4033,"… leur disparition de la scène locale : à Oaxaca en 2002 (Katz) et à La Paz en 2003 (Suremain). … Comparación del Tequila, mezcal y Calvados », Sociedades rurales. Producción y medio …","CÉ Suremain, E Katz - Anthropology of food, 2008 - journals.openedition.org","{'summary': 'CÉ Suremain, E Katz - Anthropology of food, 2008 - journals.openedition.org'}",2022-03-18 02:28:13 UTC,mezcal poverty oaxaca
Producing organic alcohol and a tequila-like liquor from Agave americana L.(Asparagaceae subfam. Agavoideae/Agavaceae) at Graaff-Reinet in the Eastern Cape …,https://bioone.org/journals/Bradleya/volume-2017/issue-35/brad.n35.2017.a3/Producing-organic-alcohol-and-a-tequila-like-liquor-from-Agave/10.25223/brad.n35.2017.a3.short,"… tequila and mezcal by the … , mezcal may be produced from about 50 different Agave species and cultigens, and can be made in eight Mexican states [all of Durango, Guerrero, Oaxaca, …","GF Smith - Bradleya, 2017 - BioOne","{'summary': 'GF Smith - Bradleya, 2017 - BioOne'}",2022-03-18 02:28:13 UTC,mezcal poverty oaxaca
"Long live dangerous thinking: or, becoming infected by the'thinginess' of",https://books.google.com/books?hl=es&lr=&id=kS8XmhQq_9gC&oi=fnd&pg=PA171&dq=mezcal+poverty+oaxaca&ots=RDDv7fPU2F&sig=qzXayAV_ucgM9TliAucQOt0v5no,"… and Michoacán, while white mezcal straight from the still is … of mezcal. Thus the term vino is used to refer to cheaper, often down graded, types of mezcal while tequila refers to a mezcal …","G Verschoor - … in Development: Actors, Networks and Cultural …, 2001 - books.google.com","{'summary': 'G Verschoor - … in Development: Actors, Networks and Cultural …, 2001 - books.google.com', 'authors': [{'name': 'G Verschoor', 'link': 'https://scholar.google.com/citations?user=6HZ_GQoAAAAJ&hl=es&oi=sra', 'serpapi_scholar_link': 'https://serpapi.com/search.json?author_id=6HZ_GQoAAAAJ&engine=google_scholar_author&hl=es', 'author_id': '6HZ_GQoAAAAJ'}]}",2022-03-18 02:28:13 UTC,mezcal poverty oaxaca
4. Going Home,https://www.degruyter.com/document/doi/10.7560/712683-006/html,"… northwestern part of the state of Oaxaca. Through the lively and … is the result of the combination of poverty, insecurity, and … a clear fluid that turned out to be mezcal. I was asked to take a …","A Wright - The Death of Ramón González, 2021 - degruyter.com","{'summary': 'A Wright - The Death of Ramón González, 2021 - degruyter.com'}",2022-03-18 02:28:13 UTC,mezcal poverty oaxaca
A Note On The Process of Editing,https://www.der.org/resources/guides/those-with-voice-study-guide.pdf,"… Mezcal. The staff was comprised of a ragtag assemblage of media activists, university students and Oaxaca … from Mexico City whose brother lived in Oaxaca. After the festival was over I …",H Kleivan - 2007 - der.org,{'summary': 'H Kleivan - 2007 - der.org'},2022-03-18 02:28:13 UTC,mezcal poverty oaxaca
"Globalización y dieta: significados, cultura y consecuencias en la nutrición",https://renavisan.ins.gob.pe/sites/default/files/62.antropologia_y_nutricion_2006_-_bertran_m.pdf#page=27,"… estuve en el estado de Oaxaca como estudiante de posgrado … “Ecología humana en el valle de Oaxaca”, mi trabajo consistió … el mezcal, el pulque, el tepache y bebidas embotelladas. …","E Messer - Antropología y nutrición. México DF: Fundación …, 2006 - renavisan.ins.gob.pe","{'summary': 'E Messer - Antropología y nutrición. México DF: Fundación …, 2006 - renavisan.ins.gob.pe'}",2022-03-18 02:28:13 UTC,mezcal poverty oaxaca
Traditional Fermented Beverages of Mexico: A Biocultural Unseen Foodscape,https://www.mdpi.com/1304724,"… , mainly in the state of Oaxaca. It can be highlighted that this … one of the sectors living in extreme poverty with no access to … salmiana varieties are still in use for both pulque and mezcal …","C Ojeda-Linares, GD Álvarez-Ríos… - Foods, 2021 - mdpi.com","{'summary': 'C Ojeda-Linares, GD Álvarez-Ríos… - Foods, 2021 - mdpi.com'}",2022-03-18 02:28:13 UTC,mezcal poverty oaxaca
Struggling for respect and dignity: strategies for shaping meaningful lives among persons with disability and their families in a community on the Mexican south-pacific …,https://www.duo.uio.no/handle/10852/16673,"… In this environment of rural poverty women are active agents, although many employ … Thus I travelled from the south of Mexico City, through Cholula, Puebla, to the city of Oaxaca, before …",MA Bergstrøm - 2007 - duo.uio.no,{'summary': 'MA Bergstrøm - 2007 - duo.uio.no'},2022-03-18 02:28:13 UTC,mezcal poverty oaxaca
Experiences of Oaxacan Youth Attending High School in Los Angeles: Implications for Educational Practice,https://search.proquest.com/openview/6fa11afd1fc6458d3f8bd8b669bef768/1?pq-origsite=gscholar&cbl=18750&diss=y,… developed southern states like Chiapas and Oaxaca. These tend to be areas with the largest number of Indigenous peoples and the highest rates of poverty and illiteracy in the nation. …,GM Taglieri - 2020 - search.proquest.com,{'summary': 'GM Taglieri - 2020 - search.proquest.com'},2022-03-18 02:28:13 UTC,mezcal poverty oaxaca
"México: consumo, pobreza y desigualdad a nivel municipal 1990-2005",https://idl-bnc-idrc.dspacedirect.org/handle/10625/39821,"… estado de Oaxaca, 6 en el de Puebla y 1 en el de San Luis Potosí. Para 2005, en Oaxaca estaban … La escasa actividad de procesamiento radica en la elaboración familiar de mezcal y …","A Yúnez Naude… - … para el Desarrollo …, 2009 - idl-bnc-idrc.dspacedirect.org","{'summary': 'A Yúnez Naude… - … para el Desarrollo …, 2009 - idl-bnc-idrc.dspacedirect.org', 'authors': [{'name': 'A Yúnez Naude', 'link': 'https://scholar.google.com/citations?user=6j1F8bYAAAAJ&hl=es&oi=sra', 'serpapi_scholar_link': 'https://serpapi.com/search.json?author_id=6j1F8bYAAAAJ&engine=google_scholar_author&hl=es', 'author_id': '6j1F8bYAAAAJ'}]}",2022-03-18 02:28:13 UTC,mezcal poverty oaxaca
The Evolution of Mexican Cuisine,https://books.google.com/books?hl=es&lr=&id=jbwpEAAAQBAJ&oi=fnd&pg=PT260&dq=mezcal+poverty+oaxaca&ots=rux5DdBeNT&sig=JTJxnOjXvu9Ha1U3ACDSrmsygSs,"… indeed anchored in precariousness and poverty, but it turns … Oaxaca; the agave plant is the source of mezcal as well as the maguey worm, which is sometimes added to bottles of mezcal…","FG Seasons - Food, Texts, and Cultures in Latin America and …, 2021 - books.google.com","{'summary': 'FG Seasons - Food, Texts, and Cultures in Latin America and …, 2021 - books.google.com'}",2022-03-18 02:28:13 UTC,mezcal poverty oaxaca
"México: consumo, pobreza y desigualdad a nivel municipal 1990-2005",https://idl-bnc-idrc.dspacedirect.org/handle/10625/39821,"… estado de Oaxaca, 6 en el de Puebla y 1 en el de San Luis Potosí. Para 2005, en Oaxaca estaban … La escasa actividad de procesamiento radica en la elaboración familiar de mezcal y …","A Yúnez Naude… - … para el Desarrollo …, 2009 - idl-bnc-idrc.dspacedirect.org","{'summary': 'A Yúnez Naude… - … para el Desarrollo …, 2009 - idl-bnc-idrc.dspacedirect.org', 'authors': [{'name': 'A Yúnez Naude', 'link': 'https://scholar.google.com/citations?user=6j1F8bYAAAAJ&hl=es&oi=sra', 'serpapi_scholar_link': 'https://serpapi.com/search.json?author_id=6j1F8bYAAAAJ&engine=google_scholar_author&hl=es', 'author_id': '6j1F8bYAAAAJ'}]}",2022-03-18 02:28:13 UTC,mezcal poverty oaxaca
The Evolution of Mexican Cuisine,https://books.google.com/books?hl=es&lr=&id=jbwpEAAAQBAJ&oi=fnd&pg=PT260&dq=mezcal+poverty+oaxaca&ots=rux5DdBeNX&sig=htXKxQtI5JtFj_jcUYLrUDmK8EA,"… indeed anchored in precariousness and poverty, but it turns … Oaxaca; the agave plant is the source of mezcal as well as the maguey worm, which is sometimes added to bottles of mezcal…","FG Seasons - Food, Texts, and Cultures in Latin America and …, 2021 - books.google.com","{'summary': 'FG Seasons - Food, Texts, and Cultures in Latin America and …, 2021 - books.google.com'}",2022-03-18 02:28:13 UTC,mezcal poverty oaxaca
The Tyranny of Common Sense: Mexico's Post-neoliberal Conversion,https://books.google.com/books?hl=es&lr=&id=uu0gEAAAQBAJ&oi=fnd&pg=PT6&dq=mezcal+poverty+oaxaca&ots=5wfSrvnVZa&sig=RtEXv8tRdMP5uDaEEm_hTzofNOs,"… , and scarcity deepening inequality and increasing poverty. This perception is grounded, on the … comprises 76 municipalities in the adjunct states of Oaxaca and Veracruz, as well as the …",I Emmelhainz - 2021 - books.google.com,{'summary': 'I Emmelhainz - 2021 - books.google.com'},2022-03-18 02:28:13 UTC,mezcal poverty oaxaca
Prevention issues in a multicultural developing country: The Mexican case,https://www.tandfonline.com/doi/abs/10.3109/10826089609063996,"… related to both development and poverty, such as preventable … , ie, Chiapas with 30% and Oaxaca with 27.5%. The levels of formal … clandestine mezcal made with nondrinkable alcohol. …","HÉE Rosovsky, M Romero - Substance use & misuse, 1996 - Taylor & Francis","{'summary': 'HÉE Rosovsky, M Romero - Substance use & misuse, 1996 - Taylor & Francis'}",2022-03-18 02:28:13 UTC,mezcal poverty oaxaca
Analysis of Potential Factors Affecting Beef Consumption in Five States of Mexico,https://shareok.org/bitstream/handle/11244/10529/Thesis-2003-B368a.pdf?sequence=1,"… Lichfield (2000) said, ''Today the South-above all the seven southeastern states of Guerrero, Oaxaca, Chiapas, Campeche, Tabasco, Veracruz and Quintana Roohas more poverty, a …",TJ Beardsley - 2003 - shareok.org,{'summary': 'TJ Beardsley - 2003 - shareok.org'},2022-03-18 02:28:13 UTC,mezcal poverty oaxaca
The Indigenous Word in Mesoamerica,https://www.degruyter.com/document/doi/10.7560/705807-005/html,"… ’s cooking fire in the mountains of Oaxaca or Chiapas. Gestures, … elderly woman whose name was Poverty, and she lived on … ’’: her heavy consumption of mezcal induces in her a type of …","D Frischmann - Words of the True Peoples/Palabras de los Seres …, 2021 - degruyter.com","{'summary': 'D Frischmann - Words of the True Peoples/Palabras de los Seres …, 2021 - degruyter.com'}",2022-03-18 02:28:13 UTC,mezcal poverty oaxaca
"Shantytown Mexico: The Democratic Opening in Ciudad Nezahualcóyotl, 1969–1976",https://www.cambridge.org/core/journals/americas/article/shantytown-mexico-the-democratic-opening-in-ciudad-nezahualcoyotl-19691976/CDDC27A6EC0190E47DDD5070D4BD9B63,"… It was portrayed as an extreme concentration of urban poverty … Beatles, drinking over marijuana, mezcal over pulque (when they … His family, in the Mixteca Baja region of Oaxaca, spoke …","D Yee - The Americas, 2021 - cambridge.org","{'summary': 'D Yee - The Americas, 2021 - cambridge.org'}",2022-03-18 02:28:13 UTC,mezcal poverty oaxaca
"Traditional ecological knowledge in community forest management: Evolution and limitations in Mexican forest law, policy and practice",https://www.mdpi.com/682446,"… mezcal, a now booming traditional distilled spirit produced from various, often wild, Agave species [101,102,136]. The knowledge to produce traditional mezcal … de Oaxaca rejected clear …","JA Sierra-Huelsz, P Gerez Fernández… - Forests, 2020 - mdpi.com","{'summary': 'JA Sierra-Huelsz, P Gerez Fernández… - Forests, 2020 - mdpi.com', 'authors': [{'name': 'JA Sierra-Huelsz', 'link': 'https://scholar.google.com/citations?user=pd1juOoAAAAJ&hl=es&oi=sra', 'serpapi_scholar_link': 'https://serpapi.com/search.json?author_id=pd1juOoAAAAJ&engine=google_scholar_author&hl=es', 'author_id': 'pd1juOoAAAAJ'}, {'name': 'P Gerez Fernández', 'link': 'https://scholar.google.com/citations?user=obTLtLEAAAAJ&hl=es&oi=sra', 'serpapi_scholar_link': 'https://serpapi.com/search.json?author_id=obTLtLEAAAAJ&engine=google_scholar_author&hl=es', 'author_id': 'obTLtLEAAAAJ'}]}",2022-03-18 02:28:13 UTC,mezcal poverty oaxaca
Considerations on the use of biofertilizers as a sustainable agro-biotechnological alternative to food security in Mexico,http://www.scielo.org.mx/scielo.php?pid=S2007-09342020000601423&script=sci_arttext&tlng=en,"Since the Postclassic, Mexica farmers unknowingly took advantage of the great microbial diversity present in the lake bed that they used as a substrate in their agricultural production …","IF Chávez-Díaz, LX Zelaya Molina… - Revista mexicana de …, 2020 - scielo.org.mx","{'summary': 'IF Chávez-Díaz, LX Zelaya Molina… - Revista mexicana de …, 2020 - scielo.org.mx', 'authors': [{'name': 'LX Zelaya Molina', 'link': 'https://scholar.google.com/citations?user=3mT1vYwAAAAJ&hl=es&oi=sra', 'serpapi_scholar_link': 'https://serpapi.com/search.json?author_id=3mT1vYwAAAAJ&engine=google_scholar_author&hl=es', 'author_id': '3mT1vYwAAAAJ'}]}",2022-03-18 02:28:13 UTC,mezcal poverty oaxaca
"US Border Partrol Abuses, Undocumented Mexican Workers, and International Human Rights",https://heinonline.org/hol-cgi-bin/get_pdf.cgi?handle=hein.journals/sdintl2&section=6,"… In general, these peoples are in dire poverty and survive by the … Oaxaca and surrounded by steep mountains and archeological sites to organize a fiesta del pueblo with plenty of mezcal…","JA Vargas - San Diego Int'l LJ, 2001 - HeinOnline","{'summary': ""JA Vargas - San Diego Int'l LJ, 2001 - HeinOnline""}",2022-03-18 02:28:13 UTC,mezcal poverty oaxaca
Diary of a Guerrilla,https://books.google.com/books?hl=es&lr=&id=Wn1P4j_d9p8C&oi=fnd&pg=PA1&dq=mezcal+poverty+oaxaca&ots=H_8jbWLK4H&sig=Zqtx4M3-l4oLaNTndboDdH0R7C8,"… the village, through epochs of poverty and times of territorial conflict with … live in Oaxaca or Mexico City, or the United States, as … had to prove himself first by downing two shots of mezcal. …",T Pérez - 1999 - books.google.com,{'summary': 'T Pérez - 1999 - books.google.com'},2022-03-18 02:28:13 UTC,mezcal poverty oaxaca
"Naturally Healthy Mexican Cooking: Authentic Recipes for Dieters, Diabetics, and All Food Lovers",https://books.google.com/books?hl=es&lr=&id=wkFOBAAAQBAJ&oi=fnd&pg=PR6&dq=mezcal+poverty+oaxaca&ots=BsJAnWwtha&sig=2xKKHl1kMnCmOcTCC2wnrNWsekY,"… of them were forced to live in poverty. To feed their families, … family from which tequila and mezcal come. The native population … Mexico and especially in Oaxaca to flavor everything from …",J Peyton - 2014 - books.google.com,{'summary': 'J Peyton - 2014 - books.google.com'},2022-03-18 02:28:13 UTC,mezcal poverty oaxaca
Changing fields of anthropology: From local to global,https://books.google.com/books?hl=es&lr=&id=8cdqAAAAQBAJ&oi=fnd&pg=PP1&dq=mezcal+poverty+oaxaca&ots=c4oQGNTqan&sig=XKaYnBfLCPJkqMEFFPVkz4L1Ugs,"… Mixtec migrant workers from Oaxaca in Riverside in 1978, and … tricks, such as holding the mezcal in my mouth after it had … I attributed my fortunes in life compared with the poverty of …",M Kearney - 2004 - books.google.com,{'summary': 'M Kearney - 2004 - books.google.com'},2022-03-18 02:28:13 UTC,mezcal poverty oaxaca
Local solutions for environmental justice,https://library.oapen.org/bitstream/handle/20.500.12657/27908/1002091.pdf?sequence=1#page=266,"… of Oaxaca, the materials for this chapter draw on additional … of subsistence, as the poverty in material means limits their … Mexican alcoholic drink, mezcal, modifying the traditional …","D Barkin, B Lemus - Environmental Governance in Latin America, 2016 - library.oapen.org","{'summary': 'D Barkin, B Lemus - Environmental Governance in Latin America, 2016 - library.oapen.org', 'authors': [{'name': 'D Barkin', 'link': 'https://scholar.google.com/citations?user=hWmvVygAAAAJ&hl=es&oi=sra', 'serpapi_scholar_link': 'https://serpapi.com/search.json?author_id=hWmvVygAAAAJ&engine=google_scholar_author&hl=es', 'author_id': 'hWmvVygAAAAJ'}]}",2022-03-18 02:28:13 UTC,mezcal poverty oaxaca
De Yucatán a Chiloé: dinámicas territoriales en América Latina,https://books.google.com/books?hl=es&lr=&id=poxKqRBMJKcC&oi=fnd&pg=PA11&dq=mezcal+poverty+oaxaca&ots=th848xVD7m&sig=VyU6BOecsBxs-RG9ES8wvkb1LA0,Las desigualdades en las oportunidades de desarrollo y el bienestar al interior de los países de América Latina han motivado un creciente interés por el desarrollo territorial como …,"JA Berdegué, FM Benito - 2012 - books.google.com","{'summary': 'JA Berdegué, FM Benito - 2012 - books.google.com'}",2022-03-18 02:28:13 UTC,mezcal poverty oaxaca
"Social and economic contradictions of rural migrant contract labor between Tlaxcala, Mexico and Canada",https://www.academia.edu/download/48806043/cag.2002.24.2.120160913-12979-1l267v7.pdf,"… Catherine Colby, who worked in rural Oaxaca in the mid-1990s, stated, ""it is not unusual for … laborers has much to do with their extreme poverty and lack of domestic alternatives. Canada…","L Binford - Culture & Agriculture, 2002 - academia.edu","{'summary': 'L Binford - Culture & Agriculture, 2002 - academia.edu'}",2022-03-18 02:28:13 UTC,mezcal poverty oaxaca
Toward a New Paradigm for Anthropology in Mexican Studies,https://www.jstor.org/stable/1051882,"… Oaxaca (shorthand for Oaxaca City in their book title), and their book, Social Inequality in Oaxaca, … El impacto de la agroindustria del mezcal de la estructura social de una comunidad."" …",S Cook - 1993 - JSTOR,{'summary': 'S Cook - 1993 - JSTOR'},2022-03-18 02:28:13 UTC,mezcal poverty oaxaca
"Afewyears aGo, on August 6, 2007, the political-culinary manifesto “Campaign in defense of native corn starts in the Historical Center” was published in La Jornada …",https://books.google.com/books?hl=es&lr=&id=aV3cDwAAQBAJ&oi=fnd&pg=PA238&dq=mezcal+poverty+oaxaca&ots=8lrBcuf3EI&sig=YqWrFwNzUMEsnDBnWAJJLDAWLTk,"… indeed anchored in precariousness and poverty, but it turns … Oaxaca; the agave plant is the source of mezcal as well as the maguey worm, which is sometimes added to bottles of mezcal…","FG Seasons - Food, Texts, and Cultures in Latin America and …, 2020 - books.google.com","{'summary': 'FG Seasons - Food, Texts, and Cultures in Latin America and …, 2020 - books.google.com'}",2022-03-18 02:28:13 UTC,mezcal poverty oaxaca
Intensificação produtiva sustentável na agricultura familiar em países tropicais em desenvolvimento,https://www.scielo.br/pdf/cagro/v43/1981-1829-cagro-43-e012819.pdf,"… , it is still necessary to better understand their characteristics and to construct viable technical and economic alternatives for these farmers, favoring development, overcoming poverty …","LRS Taveira, TS Carvalho, AFS Teixeira… - Ciência e …, 2019 - SciELO Brasil","{'summary': 'LRS Taveira, TS Carvalho, AFS Teixeira… - Ciência e …, 2019 - SciELO Brasil'}",2022-03-18 02:28:13 UTC,mezcal poverty oaxaca
International Migration and Social Transformation in the Neoliberal Era: A Case Study of Mixtecos as Indigenous People in Mexico and Irregular Migrants in the US,https://ses.library.usyd.edu.au/handle/2123/17407,"… -structured interviews with key informants across Oaxaca and California; and analysis using … devaluation of Indigenous land and labour in Oaxaca, in parallel with the incorporation of ‘…",MM Arias Cubas - 2017 - ses.library.usyd.edu.au,"{'summary': 'MM Arias Cubas - 2017 - ses.library.usyd.edu.au', 'authors': [{'name': 'MM Arias Cubas', 'link': 'https://scholar.google.com/citations?user=MrRpGi8AAAAJ&hl=es&oi=sra', 'serpapi_scholar_link': 'https://serpapi.com/search.json?author_id=MrRpGi8AAAAJ&engine=google_scholar_author&hl=es', 'author_id': 'MrRpGi8AAAAJ'}]}",2022-03-18 02:28:13 UTC,mezcal poverty oaxaca
Regiones Movilidad y aprendizaje,http://www.repositoriodigital.ipn.mx/bitstream/123456789/20014/1/Regiones%20Movilidad%20y%20Aprendizaje.pdf,… LA INCIDENCIA DE LA ADMINISTRACIÓN EN LA INDUSTRIA ARTESANAL DEL MEZCAL EN EL ESTADO DE OAXACA. MARÍA JIMÉNEZ GUTIÉRREZ Y KARLA DE LOS ÁNGELES …,JA Zarazúa-Escobar - 2009 - repositoriodigital.ipn.mx,"{'summary': 'JA Zarazúa-Escobar - 2009 - repositoriodigital.ipn.mx', 'authors': [{'name': 'JA Zarazúa-Escobar', 'link': 'https://scholar.google.com/citations?user=_wMuackAAAAJ&hl=es&oi=sra', 'serpapi_scholar_link': 'https://serpapi.com/search.json?author_id=_wMuackAAAAJ&engine=google_scholar_author&hl=es', 'author_id': '_wMuackAAAAJ'}]}",2022-03-18 02:28:13 UTC,mezcal poverty oaxaca
Neoliberal Government and community forestry: subjection and discourse in a Oaxacan Community,https://corpus.ulaval.ca/jspui/handle/20.500.11794/20050,"… the state of Oaxaca, … Oaxaca, company representatives and agrarian officials often arrived at community meetings together and contracts were often signed amidst freely flowing mezcal…",MG Rosen - 2008 - corpus.ulaval.ca,{'summary': 'MG Rosen - 2008 - corpus.ulaval.ca'},2022-03-18 02:28:13 UTC,mezcal poverty oaxaca
"Populism and neo-populism in Latin America, especially Mexico",https://www.cambridge.org/core/journals/journal-of-latin-american-studies/article/populism-and-neopopulism-in-latin-america-especially-mexico/401E8A8B4A52D11EEFE5ED6F8156E2ED,"… with a populist one-liner: ‘the Licenciado is too big a candidate for Oaxaca; the Licenciado drinks champagne; I drink mezcal; I ought to be Governor’.&( Sure enough, Jime!nez won. …","A Knight - Journal of Latin American Studies, 1998 - cambridge.org","{'summary': 'A Knight - Journal of Latin American Studies, 1998 - cambridge.org'}",2022-03-18 02:28:13 UTC,mezcal poverty oaxaca
