Title,Link,Snippet,Summary,Info,Processed,Query
In the Wake of Insurgency: Testimony and the Politics of Memory and Silence in Oaxaca,https://deepblue.lib.umich.edu/handle/2027.42/147480,"… research conducted between 2008 and 2017 in Oaxaca City, San Agustín Loxicha, and two … in Oaxaca. It specifically focuses on two cases of rebellion and repression in Oaxaca—the …",B Renero - 2018 - deepblue.lib.umich.edu,{'summary': 'B Renero - 2018 - deepblue.lib.umich.edu'},2022-03-18 02:28:13 UTC,mezcal poverty oaxaca
"Rearticulating the Social: Spatial Practices, Collective Subjects, and Oaxaca's Art of Protest",https://search.proquest.com/openview/0efe4b0228c1314fa2cf62063414d370/1?pq-origsite=gscholar&cbl=18750,"… how the popular uprising begun in Oaxaca, Mexico in 2006 is … Assembly of the People's of Oaxaca, or APPO. Focusing on … Authoritarian politics, poverty, and social protests have been …",I Arenas - 2011 - search.proquest.com,{'summary': 'I Arenas - 2011 - search.proquest.com'},2022-03-18 02:28:13 UTC,mezcal poverty oaxaca
Communities Surviving Migration,https://api.taylorfrancis.com/content/books/mono/download?identifierName=doi&identifierValue=10.4324/9781315183848&type=googlepdf,… person of mixed European and Indian origin mezcal distilled spirit made from the maguey (… highland region of Oaxaca (eg Sierra Norte de Oaxaca) sierra highlands or mountain range …,"JP Robson, D Klooster, J Hernández-Díaz - 2019 - api.taylorfrancis.com","{'summary': 'JP Robson, D Klooster, J Hernández-Díaz - 2019 - api.taylorfrancis.com', 'authors': [{'name': 'JP Robson', 'link': 'https://scholar.google.com/citations?user=zVk3YZAAAAAJ&hl=es&oi=sra', 'serpapi_scholar_link': 'https://serpapi.com/search.json?author_id=zVk3YZAAAAAJ&engine=google_scholar_author&hl=es', 'author_id': 'zVk3YZAAAAAJ'}]}",2022-03-18 02:28:13 UTC,mezcal poverty oaxaca
"Popular sustainable development, or ecological economics from below",https://papers.ssrn.com/sol3/papers.cfm?abstract_id=3387134,"… In response, we suggest that what appears as poverty in many … Mexican alcoholic drink, mezcal, modifying the traditional … In another region of Oaxaca, four communities continue to …","D Barkin - 2017) The Essential Guide to Critical Development …, 2017 - papers.ssrn.com","{'summary': 'D Barkin - 2017) The Essential Guide to Critical Development …, 2017 - papers.ssrn.com', 'authors': [{'name': 'D Barkin', 'link': 'https://scholar.google.com/citations?user=hWmvVygAAAAJ&hl=es&oi=sra', 'serpapi_scholar_link': 'https://serpapi.com/search.json?author_id=hWmvVygAAAAJ&engine=google_scholar_author&hl=es', 'author_id': 'hWmvVygAAAAJ'}]}",2022-03-18 02:28:13 UTC,mezcal poverty oaxaca
Strategies of Mexican Rural Communities to Entry in the Local and Global Markets,http://www.davidpublisher.com/Public/uploads/Contribute/5bcfe0badd40a.pdf,"… middlemen at low prices; mezcal is produced in a traditional … around half of population in poverty and to control social … a paved road to Oaxaca city, the largest city in Oaxaca state. Thus, …","AS Gijón Cruz, AS Reyes Morales… - Economics …, 2018 - davidpublisher.com","{'summary': 'AS Gijón Cruz, AS Reyes Morales… - Economics …, 2018 - davidpublisher.com', 'authors': [{'name': 'AS Gijón Cruz', 'link': 'https://scholar.google.com/citations?user=0Wu5qI0AAAAJ&hl=es&oi=sra', 'serpapi_scholar_link': 'https://serpapi.com/search.json?author_id=0Wu5qI0AAAAJ&engine=google_scholar_author&hl=es', 'author_id': '0Wu5qI0AAAAJ'}, {'name': 'AS Reyes Morales', 'link': 'https://scholar.google.com/citations?user=CkGoNnEAAAAJ&hl=es&oi=sra', 'serpapi_scholar_link': 'https://serpapi.com/search.json?author_id=CkGoNnEAAAAJ&engine=google_scholar_author&hl=es', 'author_id': 'CkGoNnEAAAAJ'}]}",2022-03-18 02:28:13 UTC,mezcal poverty oaxaca
"Alquimista de los Sabores: Gastronomic Heritage, Gender, and the Tourist Imaginary in Mexico",http://cejsh.icm.edu.pl/cejsh/element/bwmeta1.element.ojs-issn-2081-1160-year-2019-issue-24-article-557,"… -17 en la región central de Oaxaca y del análisis de fuentes … shops and bars specializing in mezcal tasting, to eateries at … to the tales of sweeping poverty, drug-related crimes, and the …","R Hryciuk - Revista del CESLA. International Latin American …, 2019 - cejsh.icm.edu.pl","{'summary': 'R Hryciuk - Revista del CESLA. International Latin American …, 2019 - cejsh.icm.edu.pl', 'authors': [{'name': 'R Hryciuk', 'link': 'https://scholar.google.com/citations?user=FFX7zykAAAAJ&hl=es&oi=sra', 'serpapi_scholar_link': 'https://serpapi.com/search.json?author_id=FFX7zykAAAAJ&engine=google_scholar_author&hl=es', 'author_id': 'FFX7zykAAAAJ'}]}",2022-03-18 02:28:13 UTC,mezcal poverty oaxaca
"Urbane gründere: en studie av ungdom og identitet i Oaxaca, Mexico",https://www.duo.uio.no/handle/10852/16805,"… Avhandlingen er basert på et feltarbeid utført i byen Oaxaca sør i Mexico, våren 2007. Temaet er ungdom fra urfolksgruppen Triqui og deres identitetsskapende prosess i en kontekst …",M Aaslie - 2008 - duo.uio.no,{'summary': 'M Aaslie - 2008 - duo.uio.no'},2022-03-18 02:28:13 UTC,mezcal poverty oaxaca
Prácticas financieras riesgosas para afrontar la crisis económica en los hogares: entre malabarismos con el dinero y sobreendeudamiento,http://www.scielo.org.mx/scielo.php?pid=S1607-050X2014000100005&script=sci_arttext,… En localidades cercanas a Miahuatlán también producen mezcal y estacionalmente se … Otro hecho que se ha vuelto común entre los socios del MB del sur de Oaxaca 22 es que los …,"L Angulo Salazar - Desacatos, 2014 - scielo.org.mx","{'summary': 'L Angulo Salazar - Desacatos, 2014 - scielo.org.mx'}",2022-03-18 02:28:13 UTC,mezcal poverty oaxaca
"The Influence of International Tourism on the Food, Drinks, and Tobacco Industry: Empirical Evidence from Mexico",https://www.tandfonline.com/doi/abs/10.1080/21568316.2021.1894600,"… that tourism serves to ameliorate poverty in rural areas. Tourism is an … mezcal, various events and tours have been created, such as the annual Mezcal International Festival in Oaxaca…","F Sánchez López - Tourism Planning & Development, 2021 - Taylor & Francis","{'summary': 'F Sánchez López - Tourism Planning & Development, 2021 - Taylor & Francis', 'authors': [{'name': 'F Sánchez López', 'link': 'https://scholar.google.com/citations?user=1aLg7msAAAAJ&hl=es&oi=sra', 'serpapi_scholar_link': 'https://serpapi.com/search.json?author_id=1aLg7msAAAAJ&engine=google_scholar_author&hl=es', 'author_id': '1aLg7msAAAAJ'}]}",2022-03-18 02:28:13 UTC,mezcal poverty oaxaca
Markets for Smallholders What about the Challenges?,https://www.researchgate.net/profile/Carolina-Moreno-13/publication/338585503_Markets_for_Smallholders_What_about_the_Challenges_Master_of_Science_in_Environmental_Governance/links/5e1e4ada45851536bfe63ba1/Markets-for-Smallholders-What-about-the-Challenges-Master-of-Science-in-Environmental-Governance.pdf,"… ; the third chapter presents the case study in Oaxaca, Mexico and its results. The final section … countries have historically suffered from poverty. Yet, poverty is a complex and evolving …",CM Hernández - 2010 - researchgate.net,{'summary': 'CM Hernández - 2010 - researchgate.net'},2022-03-18 02:28:13 UTC,mezcal poverty oaxaca
No space for being Indigenous in the educational institutions: The everyday experiences of migrant Indigenous children,https://thesis.eur.nl/pub/51398/Zarco-Fuentes-Ana-Laura_MA_2018_19_SPD.pdf,"… from their communities to Oaxaca City. These children are … communities to Oaxaca City and that live in poverty and face a … that is delicious and my uncles drink mezcal. It is like a big, …",ALZ Fuentes - 2019 - thesis.eur.nl,{'summary': 'ALZ Fuentes - 2019 - thesis.eur.nl'},2022-03-18 02:28:13 UTC,mezcal poverty oaxaca
Beyond development and modernity: Regenerating the art of living,https://books.google.com/books?hl=es&lr=&id=JCF_fld1ADoC&oi=fnd&pg=PA319&dq=mezcal+poverty+oaxaca&ots=bHCIcMd3VO&sig=YcCLWC9vRgjt5usiQzVbrsRZYfU,"… Dedicated to the modernization of poverty, it transforms the present … Her family tended a stall in Oaxaca's traditional market. I … We had no mezcal left. Then, we also left, with a feeling of …","G Esteva - Reordering of Culture: Latin America, the Caribbean …, 1995 - books.google.com","{'summary': 'G Esteva - Reordering of Culture: Latin America, the Caribbean …, 1995 - books.google.com'}",2022-03-18 02:28:13 UTC,mezcal poverty oaxaca
Changing ideological and implementational spaces for minoritised languages in higher education: Zapotequización of language education in Mexico,https://www.tandfonline.com/doi/abs/10.1080/01434632.2018.1531876,"… state of Oaxaca or in … Mezcal, along with certain clothing and music which were traditionally only made and consumed by campesinos (peasants), but are now widely popular in Oaxaca …","H De Korne, ME López Gopar… - Journal of Multilingual …, 2019 - Taylor & Francis","{'summary': 'H De Korne, ME López Gopar… - Journal of Multilingual …, 2019 - Taylor & Francis', 'authors': [{'name': 'H De Korne', 'link': 'https://scholar.google.com/citations?user=qwnUYOYAAAAJ&hl=es&oi=sra', 'serpapi_scholar_link': 'https://serpapi.com/search.json?author_id=qwnUYOYAAAAJ&engine=google_scholar_author&hl=es', 'author_id': 'qwnUYOYAAAAJ'}]}",2022-03-18 02:28:13 UTC,mezcal poverty oaxaca
Designation of Origin Distillates in Mexico: Value Chains and Territorial Development,https://www.mdpi.com/1109032,"… of Oaxaca in February 2015, among which the City of Oaxaca … and private institutions related with mezcal. Additionally, the … of mezcal and that closes the Caminos del Mezcal Tourist …","P Pérez-Akaki, NV Vega-Vera, YP Enríquez-Caballero… - Sustainability, 2021 - mdpi.com","{'summary': 'P Pérez-Akaki, NV Vega-Vera, YP Enríquez-Caballero… - Sustainability, 2021 - mdpi.com', 'authors': [{'name': 'P Pérez-Akaki', 'link': 'https://scholar.google.com/citations?user=lGSrAxQAAAAJ&hl=es&oi=sra', 'serpapi_scholar_link': 'https://serpapi.com/search.json?author_id=lGSrAxQAAAAJ&engine=google_scholar_author&hl=es', 'author_id': 'lGSrAxQAAAAJ'}]}",2022-03-18 02:28:13 UTC,mezcal poverty oaxaca
From Illegal to Industrial? The Uneven Geographies of Agave Spirits in Sonora and Beyond,https://muse.jhu.edu/article/793196/summary,"… mezcal industry in Oaxaca, and the impact this growth has had on communities on the periphery of these zones where mezcal-… , with poverty levels in some near 80%. [End Page 742] …","N Silber-Coats, EJ Lawlor - Journal of the Southwest, 2020 - muse.jhu.edu","{'summary': 'N Silber-Coats, EJ Lawlor - Journal of the Southwest, 2020 - muse.jhu.edu'}",2022-03-18 02:28:13 UTC,mezcal poverty oaxaca
"Women, forests and markets: researching poverty alleviation through commercialisation of forest resources in Mexico and Bolivia",https://www.researchgate.net/profile/Elaine-Marshall/publication/252000059_Women_forests_and_markets_researching_poverty_alleviation_through_commercialisation_of_forest_resources_in_Mexico_and_Bolivia/links/54e5af7a0cf29865c33757c0/Women-forests-and-markets-researching-poverty-alleviation-through-commercialisation-of-forest-resources-in-Mexico-and-Bolivia.pdf,"… It acknowledges that for poverty reduction to be effective, the many varied and important roles of women, including their contribution to household income generation through the use …","E Marshall, K Schreckenberg - 2002 - researchgate.net","{'summary': 'E Marshall, K Schreckenberg - 2002 - researchgate.net', 'authors': [{'name': 'K Schreckenberg', 'link': 'https://scholar.google.com/citations?user=3qqH7-MAAAAJ&hl=es&oi=sra', 'serpapi_scholar_link': 'https://serpapi.com/search.json?author_id=3qqH7-MAAAAJ&engine=google_scholar_author&hl=es', 'author_id': '3qqH7-MAAAAJ'}]}",2022-03-18 02:28:13 UTC,mezcal poverty oaxaca
Coatecas Altas: entre la marginación y la migración,https://vinculando.org/sociedadcivil/coatecas-altas-entre-marginacion-y-migracion.html,"… la comunidad de Coatecas Altas, Ejutla, Oaxaca por los estudiantes del segundo módulo del … Otro ejemplo está en la comunidad de las salinas, que venden su mezcal a precios bajos, …","CM Antonio, AS García, EA Vásquez, FD Ruiz… - Revista …, 2019 - vinculando.org","{'summary': 'CM Antonio, AS García, EA Vásquez, FD Ruiz… - Revista …, 2019 - vinculando.org'}",2022-03-18 02:28:13 UTC,mezcal poverty oaxaca
Coatecas Altas: entre la marginación y la migración,https://vinculando.org/wp-content/uploads/kalins-pdf/singles/coatecas-altas-entre-marginacion-y-migracion.pdf,"… la comunidad de Coatecas Altas, Ejutla, Oaxaca por los estudiantes del segundo módulo del … Otro ejemplo está en la comunidad de las salinas, que venden su mezcal a precios bajos, …",ATL Niño - vinculando.org,"{'summary': 'ATL Niño - vinculando.org', 'authors': [{'name': 'ATL Niño', 'link': 'https://scholar.google.com/citations?user=CMGhVpIAAAAJ&hl=es&oi=sra', 'serpapi_scholar_link': 'https://serpapi.com/search.json?author_id=CMGhVpIAAAAJ&engine=google_scholar_author&hl=es', 'author_id': 'CMGhVpIAAAAJ'}]}",2022-03-18 02:28:13 UTC,mezcal poverty oaxaca
"Education, employment, and economic growth: New directions for rural Oaxacan women",https://search.proquest.com/openview/79355fce0e7a04018776d8c8b37f63be/1?pq-origsite=gscholar&cbl=18750&diss=y,"… contemporary and historical conditions in Oaxaca, and I wish … , and evidence of continuing poverty in many developing … , five sell products (meat, mezcal and produce) they have secured …",J Howell - 1993 - search.proquest.com,{'summary': 'J Howell - 1993 - search.proquest.com'},2022-03-18 02:28:13 UTC,mezcal poverty oaxaca
Forestry Briefing,https://www.academia.edu/download/44318188/540.pdf,"… and sell them to a trader at Oaxaca market or to a community-… potential ‘poverty trap’ that keeps people in chronic poverty. … production of their traditional alcohol, Mezcal. The existence of …","K Schreckenberg, E Marshall, A Newton, DW te Velde… - academia.edu","{'summary': 'K Schreckenberg, E Marshall, A Newton, DW te Velde… - academia.edu', 'authors': [{'name': 'A Newton', 'link': 'https://scholar.google.com/citations?user=JCMrZ5YAAAAJ&hl=es&oi=sra', 'serpapi_scholar_link': 'https://serpapi.com/search.json?author_id=JCMrZ5YAAAAJ&engine=google_scholar_author&hl=es', 'author_id': 'JCMrZ5YAAAAJ'}, {'name': 'DW te Velde', 'link': 'https://scholar.google.com/citations?user=tLGvSzIAAAAJ&hl=es&oi=sra', 'serpapi_scholar_link': 'https://serpapi.com/search.json?author_id=tLGvSzIAAAAJ&engine=google_scholar_author&hl=es', 'author_id': 'tLGvSzIAAAAJ'}]}",2022-03-18 02:28:13 UTC,mezcal poverty oaxaca
Brand authenticity,https://www.utupub.fi/bitstream/handle/10024/148037/Niemela_Essi_opinnayte.pdf?sequence=1&isAllowed=y,"… Mezcal is a distilled alcoholic beverage produced from fermented agave juice. Mezcal forms … By researching mezcal brands, the purpose of this study is to describe how brand …","E Niemelä - Qualitative research, 2001 - utupub.fi","{'summary': 'E Niemelä - Qualitative research, 2001 - utupub.fi'}",2022-03-18 02:28:13 UTC,mezcal poverty oaxaca
Solid Biofuels Scenarios from Rural Agricultural and Forestry Residues for Mexican Industrial SMEs,https://www.mdpi.com/1309276,"… characterised by the general poverty of its inhabitants. … mezcal factories, we propose to replace a proportional part of the firewood used in the agave heart cooking and the mezcal …","O Ruíz-Carmona, JM Islas-Samperio… - Energies, 2021 - mdpi.com","{'summary': 'O Ruíz-Carmona, JM Islas-Samperio… - Energies, 2021 - mdpi.com'}",2022-03-18 02:28:13 UTC,mezcal poverty oaxaca
REGRESAR AL CONTENIDO,http://www.fca.uabjo.mx/media/3/2017/08/PoliticasPublicasdeDS.pdf#page=59,"… Oaxaca, one of the poorest in the country, in order to initiate a strategy to combat the two most serious problems in this locality: food poverty … No es posible que haya mezcal por la altura …","JG García, ER Alarcón - POLÍTICAS PÚBLICAS DE DESARROLLO … - fca.uabjo.mx","{'summary': 'JG García, ER Alarcón - POLÍTICAS PÚBLICAS DE DESARROLLO … - fca.uabjo.mx', 'authors': [{'name': 'JG García', 'link': 'https://scholar.google.com/citations?user=0f2SB34AAAAJ&hl=es&oi=sra', 'serpapi_scholar_link': 'https://serpapi.com/search.json?author_id=0f2SB34AAAAJ&engine=google_scholar_author&hl=es', 'author_id': '0f2SB34AAAAJ'}, {'name': 'ER Alarcón', 'link': 'https://scholar.google.com/citations?user=Irl8NiAAAAAJ&hl=es&oi=sra', 'serpapi_scholar_link': 'https://serpapi.com/search.json?author_id=Irl8NiAAAAAJ&engine=google_scholar_author&hl=es', 'author_id': 'Irl8NiAAAAAJ'}]}",2022-03-18 02:28:13 UTC,mezcal poverty oaxaca
The Teitipac Communities: Peasant-Artisans on the Hacienda's Periphery,https://www.degruyter.com/document/doi/10.7560/754768-006/html,"… poverty around the middle of the nineteenth century, earning their livelihood by making weekly trips to Oaxaca … The mezcal drinkers got into debt for their land (se endrogaban de la tierra…","S Cook - Land, Livelihood, and Civility in Southern Mexico, 2021 - degruyter.com","{'summary': 'S Cook - Land, Livelihood, and Civility in Southern Mexico, 2021 - degruyter.com'}",2022-03-18 02:28:13 UTC,mezcal poverty oaxaca
LA ORGANIZACIÓN ECONÓMICA DE LOS PEQUEÑOS Y MEDIANOS PRODUCTORES,https://www.agter.org/bdf/_docs/2018-08_robles-hector_rimisp_organizacion-economica-pequenos-productores_mexico_2_.pdf,"… , who mostly face poverty and marginalization conditions) and … en las comunidades se extiende a Oaxaca ya todo México; la … del proceso de producción de mezcal sea más eficiente …",HMR Berlanga - 2018 - agter.org,{'summary': 'HMR Berlanga - 2018 - agter.org'},2022-03-18 02:28:13 UTC,mezcal poverty oaxaca
IN MEXICO,https://link.springer.com/content/pdf/10.1007/978-3-319-73945-8.pdf,"The premise of this series is that the current environmental crisis cannot be solved by technological innovation alone and that the environmental challenges we face today are, at their …",A from Below - Springer,{'summary': 'A from Below - Springer'},2022-03-18 02:28:13 UTC,mezcal poverty oaxaca
Mayan Dusk,https://www.jstor.org/stable/24365581,"… There was a classical music festival going on in Oaxaca City and we could only find one room … I remember his blood stained eyes and the mezcal on his breath when he said: ""It's your …","J Villoro, K TRAUBE - BOMB, 2013 - JSTOR","{'summary': 'J Villoro, K TRAUBE - BOMB, 2013 - JSTOR'}",2022-03-18 02:28:13 UTC,mezcal poverty oaxaca
Commercialization of non-timber forest products: factors influencing success: lessons learned from Mexico and Bolivia and policy implications for decision …,https://books.google.com/books?hl=es&lr=&id=L8_tWxiE6fUC&oi=fnd&pg=PA3&dq=mezcal+poverty+oaxaca&ots=C3KYd33kfI&sig=hXukzphVtL3icp08ABTxpXw6zUk,"… NTFP commercialization can reduce poverty, and can provide … Figure 3.12 Value chain for mezcal showing two routes: local … three routes: local fresh to Oaxaca markets, local to be dried …","K Schreckenberg, AC Newton - 2006 - books.google.com","{'summary': 'K Schreckenberg, AC Newton - 2006 - books.google.com', 'authors': [{'name': 'K Schreckenberg', 'link': 'https://scholar.google.com/citations?user=3qqH7-MAAAAJ&hl=es&oi=sra', 'serpapi_scholar_link': 'https://serpapi.com/search.json?author_id=3qqH7-MAAAAJ&engine=google_scholar_author&hl=es', 'author_id': '3qqH7-MAAAAJ'}, {'name': 'AC Newton', 'link': 'https://scholar.google.com/citations?user=JCMrZ5YAAAAJ&hl=es&oi=sra', 'serpapi_scholar_link': 'https://serpapi.com/search.json?author_id=JCMrZ5YAAAAJ&engine=google_scholar_author&hl=es', 'author_id': 'JCMrZ5YAAAAJ'}]}",2022-03-18 02:28:13 UTC,mezcal poverty oaxaca
Extending authenticity: Going corporate in a craft market,https://www.sciencedirect.com/science/article/pii/S0304422X1930021X,"… In the early 1990s, Ron Cooper traveled to Mexico and tried mezcal, a distilled agave spirit, that … Five years later, he founded Del Maguey Mezcal in the southern highlands of Oaxaca. “I …","MS Gaytán - Poetics, 2019 - Elsevier","{'summary': 'MS Gaytán - Poetics, 2019 - Elsevier'}",2022-03-18 02:28:13 UTC,mezcal poverty oaxaca
La pluralidad de sentidos en la poesía inicial de Elizabeth Bishop,https://digital.lib.washington.edu/researchworks/bitstream/handle/1773/24062/Thompson_washington_0250O_11482.pdf?sequence=1,"… de crear una ""atmosphere of poverty"" y que también estaba … y viajan en tren hasta Oaxaca. Allí Bishop se entusiasma por … sobre las fiestas en su pueblo (""mucho mezcal"") y su nieto. …",E Thompson - 2013 - digital.lib.washington.edu,{'summary': 'E Thompson - 2013 - digital.lib.washington.edu'},2022-03-18 02:28:13 UTC,mezcal poverty oaxaca
A Trypanosoma cruzi strain from southern Mexico is more virulent for male mice in part by blocking the immune response,https://www.jidc.org/index.php/journal/article/view/15211,"… niches where the insect vector resides as well as poverty and marginalization affecting … In the current study, we identified socioeconomic conditions of the residents of Los Mezcales, …","CA Palma-González, HI Recinos-Vázquez… - The Journal of Infection …, 2021 - jidc.org","{'summary': 'CA Palma-González, HI Recinos-Vázquez… - The Journal of Infection …, 2021 - jidc.org'}",2022-03-18 02:28:13 UTC,mezcal poverty oaxaca
Acknowledgments ix,https://scholar.archive.org/work/3u7sfsvdzrb3rje54l4rz4oe6q/access/wayback/https://upcolorado.com/university-press-of-colorado/item/download/428_def82bc497a008595939b5c985a92515,"… As such, this volume’s spotlight on Oaxaca is firmly rooted in the idiosyncratic geographical, material, … of traditional lifeways and the state’s endemic poverty (Oaxaca being the second …","D Zborover, R Spores, JMD Pohl, V König… - scholar.archive.org","{'summary': 'D Zborover, R Spores, JMD Pohl, V König… - scholar.archive.org', 'authors': [{'name': 'D Zborover', 'link': 'https://scholar.google.com/citations?user=Iiwr528AAAAJ&hl=es&oi=sra', 'serpapi_scholar_link': 'https://serpapi.com/search.json?author_id=Iiwr528AAAAJ&engine=google_scholar_author&hl=es', 'author_id': 'Iiwr528AAAAJ'}]}",2022-03-18 02:28:13 UTC,mezcal poverty oaxaca
New interdisciplinary research on Mexico's common property forests: a national survey,http://dlc.dlib.indiana.edu/dlc/handle/10535/1391,"Efforts to develop strategies coordinating federal forest policy objectives with local governance institutions in Mexico have met with major obstacles. Federal forestry projects, including …","C Antinori, O Magaña Torres… - … Property, Oaxaca …, 2004 - dlc.dlib.indiana.edu","{'summary': 'C Antinori, O Magaña Torres… - … Property, Oaxaca …, 2004 - dlc.dlib.indiana.edu'}",2022-03-18 02:28:13 UTC,mezcal poverty oaxaca
"Calling the soul back to the heart: soul loss, depression and healing among indigenous Mexicans",https://search.proquest.com/openview/408d4407e71b00eeccc2741876c0b6a0/1?pq-origsite=gscholar&cbl=18750&diss=y,… since my first visit to Oaxaca in 1987. Further thanks to the … Here there is only poverty. They left- we are poor and they … (a local cactus used for making mezcal liquor). Animals owned …,B Taub - 1992 - search.proquest.com,{'summary': 'B Taub - 1992 - search.proquest.com'},2022-03-18 02:28:13 UTC,mezcal poverty oaxaca
Postface: Is there Mexican Food? Taste and the Politics of Cultural Identity,https://books.google.com/books?hl=es&lr=&id=4Fl-DwAAQBAJ&oi=fnd&pg=PA207&dq=mezcal+poverty+oaxaca&ots=zjZP6FSuWa&sig=P_S6YD-FjvMgEbJ49GyckEgYcxM,"… What do we do about food traditions rooted in a form of rural poverty that people are desperate to … As Brulotte (Chapter 5) shows, the very identity of Oaxacan mezcal is motivated by …","R Wilk - Taste, Politics and Identities in Mexican Food, 2019 - books.google.com","{'summary': 'R Wilk - Taste, Politics and Identities in Mexican Food, 2019 - books.google.com', 'authors': [{'name': 'R Wilk', 'link': 'https://scholar.google.com/citations?user=d8efMHsAAAAJ&hl=es&oi=sra', 'serpapi_scholar_link': 'https://serpapi.com/search.json?author_id=d8efMHsAAAAJ&engine=google_scholar_author&hl=es', 'author_id': 'd8efMHsAAAAJ'}]}",2022-03-18 02:28:13 UTC,mezcal poverty oaxaca
"Ambiguous missionaries: rural teachers and state facades in Guerrero, 1930-1950",https://online.ucpress.edu/msem/article-abstract/22/2/331/61330,"… She had built her own mezcal distillery and sent one of the … of mezcal factories, and the alchemical transformation of lo- … of a maestro in 1930s Oaxaca whose drive to castellanizar his …","P Gillingham - Mexican Studies/Estudios Mexicanos, 2006 - online.ucpress.edu","{'summary': 'P Gillingham - Mexican Studies/Estudios Mexicanos, 2006 - online.ucpress.edu'}",2022-03-18 02:28:13 UTC,mezcal poverty oaxaca
Divided over Tourism: Zapotec Responses to Mexico's' Magical Villages Program',http://notebooks.drustvo-antropologov.si/Notebooks/article/view/275,"… Zapotec village in the State of Oaxaca. This article, based on … , others suffer from extreme poverty and the lack of most basic … Earlier people drank mainly mezcal during the fiestas since it …","T Gross - Anthropological notebooks, 2011 - notebooks.drustvo-antropologov.si","{'summary': 'T Gross - Anthropological notebooks, 2011 - notebooks.drustvo-antropologov.si'}",2022-03-18 02:28:13 UTC,mezcal poverty oaxaca
Vecinos y Rehabilitation (Phase III): Assessing the Needs and Resources of Indigenous People with Disabilities in the Sierre Mixe. Final Report.[English …,https://eric.ed.gov/?id=ED433167,"… with indigenous people in Oaxaca, Mexico. Its first … of Oaxaca and worked with a grassroots organization to create solidarity among people with disabilities in the Mixteca region, Oaxaca…","CA Marshall, GS Gotto IV - 1998 - ERIC","{'summary': 'CA Marshall, GS Gotto IV - 1998 - ERIC'}",2022-03-18 02:28:13 UTC,mezcal poverty oaxaca
