Title,Link,Snippet,Summary,Info,Processed,Query
AGRICULTURAL GENETIC RESOURCES AS A SOURCE OF RESILIENCE IN THE FACE OF THE COVID-19 PANDEMIC IN MEXICO,https://www.revista.ccba.uady.mx/ojs/index.php/TSA/article/view/3841,"… 3- Ensure economic inclusion and social protection to reduce poverty. … regional climate change, social polarization, hunger and poverty in vulnerable regions, and risks to human health …","G Sandoval-Cancino, LX Zelaya-Molina… - Tropical and …, 2021 - revista.ccba.uady.mx","{'summary': 'G Sandoval-Cancino, LX Zelaya-Molina… - Tropical and …, 2021 - revista.ccba.uady.mx', 'authors': [{'name': 'LX Zelaya-Molina', 'link': 'https://scholar.google.com/citations?user=3mT1vYwAAAAJ&hl=es&oi=sra', 'serpapi_scholar_link': 'https://serpapi.com/search.json?author_id=3mT1vYwAAAAJ&engine=google_scholar_author&hl=es', 'author_id': '3mT1vYwAAAAJ'}]}",2022-03-18 02:28:13 UTC,mezcal poverty oaxaca
Latin American Studies,http://clasarchive.berkeley.edu/Publications/Review/pdf/fall2004.pdf,"… of extreme inequality, poverty and marginalization has enabled … tiny Zapotec village in Oaxaca, Mexico. I’d come to track … The next week, I was on a plane to Oaxaca to pre-interview and …","S Tegel - University of California, Berkeley, 2004 - clasarchive.berkeley.edu","{'summary': 'S Tegel - University of California, Berkeley, 2004 - clasarchive.berkeley.edu'}",2022-03-18 02:28:13 UTC,mezcal poverty oaxaca
Sotanas Rojinegras: Catholic Anticlericalism and Mexico's Revolutionary Schism,https://www.cambridge.org/core/journals/americas/article/sotanas-rojinegras-catholic-anticlericalism-and-mexicos-revolutionary-schism/4D3F78C03A9694FCBBCFDD34258A3FBF,"… consecrated tortillas and mezcal as specie—was permitted. … religious taxes while pleading poverty.Aspects of clerical discipline … and central states such as Oaxaca, Chiapas, Veracruz, …","M Butler - The Americas, 2009 - cambridge.org","{'summary': 'M Butler - The Americas, 2009 - cambridge.org'}",2022-03-18 02:28:13 UTC,mezcal poverty oaxaca
The Permit that Never Expires: migrant tales from the Ozark hills and the Mexican highlands,https://books.google.com/books?hl=es&lr=&id=36CKD7tIA-MC&oi=fnd&pg=PP8&dq=mezcal+poverty+oaxaca&ots=cao3sQjeK2&sig=vjp1cWX5t_2nmkDityPpDV6rtuU,"… by a suicidal pride, half-convinced that poverty was independence, their grandparents were … runs back and forth—but mainly forth—from Oaxaca to British Columbia. In other words, it …",P Garrison - 2010 - books.google.com,{'summary': 'P Garrison - 2010 - books.google.com'},2022-03-18 02:28:13 UTC,mezcal poverty oaxaca
La Zandunga: Of Fieldwork and Friendship in Southern Mexico,https://books.google.com/books?hl=es&lr=&id=FcUSAAAAQBAJ&oi=fnd&pg=PP2&dq=mezcal+poverty+oaxaca&ots=L_he4q_8HD&sig=UIjHTOez0fuHYxHOMgnJdsmPXSs,"… grievously I had misjudged Oaxaca. By comparison to this place, Oaxaca was a metropolitan … along one side, smoking cigarettes and drinking mezcal. Chica asked me to dance and we …",BN Chiñas - 1992 - books.google.com,{'summary': 'BN Chiñas - 1992 - books.google.com'},2022-03-18 02:28:13 UTC,mezcal poverty oaxaca
"Forsaken Harvest: Haciendas and Agrarian Reform in Jalisco, Mexico: 1915-1940",https://books.google.com/books?hl=es&lr=&id=KelvAwAAQBAJ&oi=fnd&pg=PP1&dq=mezcal+poverty+oaxaca&ots=SEgdk1YUk4&sig=OSBhpJTrvClPjCflCt_a5iE7zSA,… Theirs was a system of exploitation that kept the rural masses in wretched conditions of poverty and … Several haciendas had operated sugar and timber mills and mezcal distilleries since …,LG Cueva - 2013 - books.google.com,{'summary': 'LG Cueva - 2013 - books.google.com'},2022-03-18 02:28:13 UTC,mezcal poverty oaxaca
"Asking, We Walk: Challenging Zapaturismo in International “Activist Art” Residencies toward a Praxis of Radical Hope",https://online.ucpress.edu/esr/article-abstract/44/3/31/119090,… state of near-invisibility in the poverty-stricken rural pueblos of … our lives in between shots of mezcal. I wonder what it would … university with outposts in Oaxaca and Chiapas open to all …,"TQ Tagle, L Affourtit, M Boyadjian… - Ethnic Studies …, 2021 - online.ucpress.edu","{'summary': 'TQ Tagle, L Affourtit, M Boyadjian… - Ethnic Studies …, 2021 - online.ucpress.edu'}",2022-03-18 02:28:13 UTC,mezcal poverty oaxaca
"Migración, fronteras e identidades étnicas trasnacionales",https://books.google.com/books?hl=es&lr=&id=1XA3CwAAQBAJ&oi=fnd&pg=PT3&dq=mezcal+poverty+oaxaca&ots=QDe88NGv1c&sig=A1omwFR6sOVYwB8YmPB9o7OmX8E,"… El trabajo de Alicia Barabas, “Los migrantes indígenas de Oaxaca en Estados Unidos: … el punto de vista de los grupos indígenas de Oaxaca. Su trabajo se enfoca en la territorialidad de …",LV Ortiz - 2015 - books.google.com,"{'summary': 'LV Ortiz - 2015 - books.google.com', 'authors': [{'name': 'LV Ortiz', 'link': 'https://scholar.google.com/citations?user=fehe2wIAAAAJ&hl=es&oi=sra', 'serpapi_scholar_link': 'https://serpapi.com/search.json?author_id=fehe2wIAAAAJ&engine=google_scholar_author&hl=es', 'author_id': 'fehe2wIAAAAJ'}]}",2022-03-18 02:28:13 UTC,mezcal poverty oaxaca
Perfil nacional de México,https://www.aacademica.org/salomon.nahmad.sitton/21.pdf?view,"… No obstante, la calidad del servicio en las regiones indígenas, tal y como lo muestra el diagnóstico de Oaxaca, es deficiente, por la ausencia de médicos y la escasez de medicinas y …","S Nahmad-Sittón, T Carrasco - 1998 - aacademica.org","{'summary': 'S Nahmad-Sittón, T Carrasco - 1998 - aacademica.org'}",2022-03-18 02:28:13 UTC,mezcal poverty oaxaca
"Thoughts on Citizenship in Latin America, with Particular Reference to Mexico",https://online.ucpress.edu/msem/article-abstract/36/1-2/10/111264,"… may have made citizens in parts of central Mexico and Oaxaca, but it certainly did not in the … of Naranja or Chamula, or set up mezcal distilleries in the mountains.Results were equivocal …","P Gillingham - Mexican Studies/Estudios Mexicanos, 2020 - online.ucpress.edu","{'summary': 'P Gillingham - Mexican Studies/Estudios Mexicanos, 2020 - online.ucpress.edu'}",2022-03-18 02:28:13 UTC,mezcal poverty oaxaca
Variations on the theme of alcoholism in Rosario Castellanos's indigenist literature: a multidisciplinary analysis,https://search.proquest.com/openview/75c99df54754d06b609bbbe50401e183/1?pq-origsite=gscholar&cbl=18750&diss=y,"… All probability suggests that this was also the case with ""mezcal"", produced by distilling the heart of the agave and much more alcoholic than the ""pulque"" made from the same plant. The …",JF Jarboe - 1993 - search.proquest.com,{'summary': 'JF Jarboe - 1993 - search.proquest.com'},2022-03-18 02:28:13 UTC,mezcal poverty oaxaca
Agrarian Extractivism in Latin America,https://api.taylorfrancis.com/content/books/mono/download?identifierName=doi&identifierValue=10.4324/9780367822958&type=googlepdf,… the most effective way forward for rural poverty alleviation and rural development. According to the … They point to traditional mezcal production as a socially and ecologically sustainable …,"BM McKay, AA Fradejas, A Ezquerro-Cañete - 2021 - api.taylorfrancis.com","{'summary': 'BM McKay, AA Fradejas, A Ezquerro-Cañete - 2021 - api.taylorfrancis.com', 'authors': [{'name': 'BM McKay', 'link': 'https://scholar.google.com/citations?user=IgqXbQUAAAAJ&hl=es&oi=sra', 'serpapi_scholar_link': 'https://serpapi.com/search.json?author_id=IgqXbQUAAAAJ&engine=google_scholar_author&hl=es', 'author_id': 'IgqXbQUAAAAJ'}, {'name': 'AA Fradejas', 'link': 'https://scholar.google.com/citations?user=A9nzoe4AAAAJ&hl=es&oi=sra', 'serpapi_scholar_link': 'https://serpapi.com/search.json?author_id=A9nzoe4AAAAJ&engine=google_scholar_author&hl=es', 'author_id': 'A9nzoe4AAAAJ'}]}",2022-03-18 02:28:13 UTC,mezcal poverty oaxaca
"Claiming dignity, reconfiguring rights: gender, youth, and indigenous-led politics in Southern México",https://search.proquest.com/openview/594b03467a31c696b4c483b968a0da96/1?pq-origsite=gscholar&cbl=18750,… aligned groups based within two rural areas of Oaxaca - the Isthmus of Tehuantepec and La … massive effort in sustainable development and poverty alleviation in Southern Mexico. Civil …,M Talcott - 2008 - search.proquest.com,{'summary': 'M Talcott - 2008 - search.proquest.com'},2022-03-18 02:28:13 UTC,mezcal poverty oaxaca
Lotería Huasteca: Woodblock Prints,https://books.google.com/books?hl=es&lr=&id=qOFGCgAAQBAJ&oi=fnd&pg=PA9&dq=mezcal+poverty+oaxaca&ots=wKxlfuAGNr&sig=FJv3QNlnMnOb9duhODJcRfRGRIw,… en Oaxaca.’ Las musicas que nos dieron patria. Ed. … or distilled spirits such as tequila and mezcal. In northern Spain guaje … In the past they were synonymous with rural poverty but now …,A Dempster - 2015 - books.google.com,{'summary': 'A Dempster - 2015 - books.google.com'},2022-03-18 02:28:13 UTC,mezcal poverty oaxaca
Las disputas por el México rural,https://www.researchgate.net/profile/Juan-Sergio-Zendejas-Romero/publication/335310294_LAS_DISPUTAS_POR_EL_MEXICO_RURAL_Volumen_I_Actores_y_campos_sociales/links/5d5ec4a6a6fdcc55e820f18d/LAS-DISPUTAS-POR-EL-MEXICO-RURAL-Volumen-I-Actores-y-campos-sociales.pdf,"Basado en el 16 Coloquio de Antropología e Historia Regionales, llevado a cabo en la ciudad de Zamora, Michoacán. Contenido: Primera parte: Actores y campos sociales: …","S Zendejas, P De Vries - Transformaciones de Prácticas …, 1998 - researchgate.net","{'summary': 'S Zendejas, P De Vries - Transformaciones de Prácticas …, 1998 - researchgate.net'}",2022-03-18 02:28:13 UTC,mezcal poverty oaxaca
"Mexico in Transition: New Perspectives on Mexican Agrarian History, Nineteenth and Twentieth Centuries/México y sus transiciones: reconsideraciones sobre la …",https://repositories.lib.utexas.edu/handle/2152/20399,"As the sole publisher, CIESAS holds the copyright to this work. Users may consult or download this work for their personal use, but may not print it, nor can they distribute or …","A Escobar Ohmstede, M Butler - 2013 - repositories.lib.utexas.edu","{'summary': 'A Escobar Ohmstede, M Butler - 2013 - repositories.lib.utexas.edu', 'authors': [{'name': 'A Escobar Ohmstede', 'link': 'https://scholar.google.com/citations?user=yK2XdEEAAAAJ&hl=es&oi=sra', 'serpapi_scholar_link': 'https://serpapi.com/search.json?author_id=yK2XdEEAAAAJ&engine=google_scholar_author&hl=es', 'author_id': 'yK2XdEEAAAAJ'}]}",2022-03-18 02:28:13 UTC,mezcal poverty oaxaca
Edible Insects: A Global History,https://books.google.com/books?hl=es&lr=&id=NeczEAAAQBAJ&oi=fnd&pg=PT7&dq=mezcal+poverty+oaxaca&ots=BpPAo64e3l&sig=-oLLvzvLhH379T4tTFwIurBVw90,"… primitiveness and of material poverty; and once symbolically … popular in the state of Oaxaca, where large baskets heaped … accompanies lime and a shot of mezcal. White maguey worms, …",GL Hunter - 2021 - books.google.com,{'summary': 'GL Hunter - 2021 - books.google.com'},2022-03-18 02:28:13 UTC,mezcal poverty oaxaca
Religious culture in modern Mexico,https://books.google.com/books?hl=es&lr=&id=d1CXxGl9CNIC&oi=fnd&pg=PP11&dq=mezcal+poverty+oaxaca&ots=m4ETaKdYRp&sig=UU_r6eBJfUP3Z2ZELgw5ofUnBms,"… Concerned by the outbreak of the Mexican Revolution, the archbishop of Oaxaca, Eulogio Gillow, directed that all Catholics in Oaxaca take the oath and sign their names, and thus …",MA Nesvig - 2007 - books.google.com,"{'summary': 'MA Nesvig - 2007 - books.google.com', 'authors': [{'name': 'MA Nesvig', 'link': 'https://scholar.google.com/citations?user=1zVgtK8AAAAJ&hl=es&oi=sra', 'serpapi_scholar_link': 'https://serpapi.com/search.json?author_id=1zVgtK8AAAAJ&engine=google_scholar_author&hl=es', 'author_id': '1zVgtK8AAAAJ'}]}",2022-03-18 02:28:13 UTC,mezcal poverty oaxaca
Modelos de negocio innovadores en maíz de especialidades en México,http://aedt.chapingo.edu.mx/handle/20.500.12098/39,"… han localizado: en el sur de México (Chiapas-Oaxaca), en el occidente (Jalisco, Michoacán, Colima… Most of these producers are in the rural sector, in poverty and inequality. Despite this …","L Torres, B Jamelyd - 2018 - aedt.chapingo.edu.mx","{'summary': 'L Torres, B Jamelyd - 2018 - aedt.chapingo.edu.mx', 'authors': [{'name': 'L Torres', 'link': 'https://scholar.google.com/citations?user=hKetXzcAAAAJ&hl=es&oi=sra', 'serpapi_scholar_link': 'https://serpapi.com/search.json?author_id=hKetXzcAAAAJ&engine=google_scholar_author&hl=es', 'author_id': 'hKetXzcAAAAJ'}]}",2022-03-18 02:28:13 UTC,mezcal poverty oaxaca
Biohydrogen and Bioelectricity Generation: Core Processes in Biorefinery of Organic Solid Wastes,https://www.researchgate.net/profile/Graciano-Calva-Calva/publication/285190775_Systems_for_H2_and_bioelectricity_generation_a_crucial_component_of_biorefineries/links/571e5d0608aead26e71a8822/Systems-for-H2-and-bioelectricity-generation-a-crucial-component-of-biorefineries.pdf,"… Particularly in developing countries, with typically up to 40% to 50% of the population below the poverty line, it is immensely debatable to earmark food and feed crops for bioenergy …",PN Robledo-Narváez - researchgate.net,{'summary': 'PN Robledo-Narváez - researchgate.net'},2022-03-18 02:28:13 UTC,mezcal poverty oaxaca
Jai Alai: A Cultural History of the Fastest Game in the World,https://books.google.com/books?hl=es&lr=&id=QMmEDwAAQBAJ&oi=fnd&pg=PT7&dq=mezcal+poverty+oaxaca&ots=vcuQXcHoCS&sig=wT8AVv4reQ9SitJz818DtmLbZcE,"… on the pre-Hispanic ball game in Oaxaca, I had to investigate the … located on the southwestern side of Oaxaca. Watching my first pelota … Shots of mezcal, the local liquor made from the …",PE Morton - 2019 - books.google.com,{'summary': 'PE Morton - 2019 - books.google.com'},2022-03-18 02:28:13 UTC,mezcal poverty oaxaca
Energopolitics,https://library.oapen.org/handle/20.500.12657/24901,… But the one that attracted and held our attention most strongly was Oaxaca’s Isthmus of Tehuantepec. A gap in the Sierra Madre Mountains creates a barometric pressure differential …,D Boyer - 2019 - library.oapen.org,"{'summary': 'D Boyer - 2019 - library.oapen.org', 'authors': [{'name': 'D Boyer', 'link': 'https://scholar.google.com/citations?user=lXLN5isAAAAJ&hl=es&oi=sra', 'serpapi_scholar_link': 'https://serpapi.com/search.json?author_id=lXLN5isAAAAJ&engine=google_scholar_author&hl=es', 'author_id': 'lXLN5isAAAAJ'}]}",2022-03-18 02:28:13 UTC,mezcal poverty oaxaca
UC SANTA CRUZWinter 2000,https://review.ucsc.edu/winter.00/review-win00.pdf,"… Most of them are native Spanish speakers, and 80 percent of them come from families living below the poverty line. Teachers and administrators teamed up with UCSC to help …",A MILLENNIUM - review.ucsc.edu,{'summary': 'A MILLENNIUM - review.ucsc.edu'},2022-03-18 02:28:13 UTC,mezcal poverty oaxaca
"Agriculture, biodiversity and markets: livelihoods and agroecology in comparative perspective",https://www.taylorfrancis.com/books/mono/10.4324/9781849774376/agriculture-biodiversity-markets-stewart-lockie-david-carpenter,"… and development to eradicate hunger, poverty and environmental degradation worldwide. … forest certification in conservation and development in Oaxaca, Mexico. He obtained a PhD …","S Lockie, D Carpenter - 2009 - taylorfrancis.com","{'summary': 'S Lockie, D Carpenter - 2009 - taylorfrancis.com', 'authors': [{'name': 'S Lockie', 'link': 'https://scholar.google.com/citations?user=uOqLehMAAAAJ&hl=es&oi=sra', 'serpapi_scholar_link': 'https://serpapi.com/search.json?author_id=uOqLehMAAAAJ&engine=google_scholar_author&hl=es', 'author_id': 'uOqLehMAAAAJ'}]}",2022-03-18 02:28:13 UTC,mezcal poverty oaxaca
Imagining Alternative Agro-Food Systems in Mexico: A Case Study on Food Sovereignty and the Traspatio Oaxaqueño Initiative,https://ruor.uottawa.ca/handle/10393/34632,… friends and family in Oaxaca. Thanks to Gustavo for taking me for my first mezcalito and introducing me to the real Oaxaca. Thank you … I found in Oaxaca a home that I will never forget. …,C Martel - 2016 - ruor.uottawa.ca,{'summary': 'C Martel - 2016 - ruor.uottawa.ca'},2022-03-18 02:28:13 UTC,mezcal poverty oaxaca
"No alternative: Childbirth, citizenship, and indigenous culture in Mexico",https://books.google.com/books?hl=es&lr=&id=LyplDwAAQBAJ&oi=fnd&pg=PR9&dq=mezcal+poverty+oaxaca&ots=OCJMtTbJ8q&sig=WyqRjbibe9Rj7bpfbNW5L6vo8yE,"… from California and the state of Oaxaca. The event drew … of migrant health care for the Oaxaca Secretariat of Health to … to draw out negativity, spitting mezcal in order to cover the …",RA Vega - 2018 - books.google.com,{'summary': 'RA Vega - 2018 - books.google.com'},2022-03-18 02:28:13 UTC,mezcal poverty oaxaca
Collective action in rural Mexico: The coffee farmers movement,https://search.proquest.com/openview/7dcd5084489fce06757dfa92768b8d7d/1?pq-origsite=gscholar&cbl=18750&diss=y,"… a six month stay in the northern Isthmus part of Oaxaca from June 1996 to November 1996, … frames that challenge traditional causal notions of poverty. Creating adversaries, such as …",RM Porter - 2000 - search.proquest.com,{'summary': 'RM Porter - 2000 - search.proquest.com'},2022-03-18 02:28:13 UTC,mezcal poverty oaxaca
Livestock-wildlife Dynamics and Subsequent Human Responses in Marginalized Communities Within Mexico's Nationally Protected Areas,https://search.proquest.com/openview/76054ed32fb4483b8ad664c0464e1631/1?pq-origsite=gscholar&cbl=18750&diss=y,… Agave plants are grown and sold for reforestation as well as Mezcal distillation. Grazing … (4.59 million dollars from the municipalities within Oaxaca and 102.03 Million dollars from the …,DMF Seil - 2020 - search.proquest.com,{'summary': 'DMF Seil - 2020 - search.proquest.com'},2022-03-18 02:28:13 UTC,mezcal poverty oaxaca
Implementación de prácticas para la conservación de la biodiversidad nativa y aumento de la resiliencia comunitaria frente al cambio climático en Purulhá …,https://digi.usac.edu.gt/bvirtual/informes/puiep/INF-2018-23.pdf,"… knowledge and practices of Purulhá’s farmers in order to adapt to the effects of climate change and reduce the socio-ecological vulnerability of these groups affected by poverty, lack of …",MEE Cotton - digi.usac.edu.gt,{'summary': 'MEE Cotton - digi.usac.edu.gt'},2022-03-18 02:28:13 UTC,mezcal poverty oaxaca
Words of the True Peoples/Palabras de los Seres Verdaderos: Anthology of Contemporary Mexican Indigenous-Language Writers/Antología de Escritores …,https://books.google.com/books?hl=es&lr=&id=QfYAS_FSyYQC&oi=fnd&pg=PR9&dq=mezcal+poverty+oaxaca&ots=tES_SKCIYD&sig=K_BRZCFLRE1U5aYFhmikLjkSJkk,"… , song, and occasionally a little mezcal in Indigenous areas: Zitlala (Guerrero), Caltzontzin (Michoacán), Ocotlán de Morelos, Tlacolula, and Etla (Oaxaca), Amecameca (Estado de …","C Montemayor, D Frischmann - 2014 - books.google.com","{'summary': 'C Montemayor, D Frischmann - 2014 - books.google.com'}",2022-03-18 02:28:13 UTC,mezcal poverty oaxaca
Transborder media spaces: Ayuujk videomaking between Mexico and the US,https://books.google.com/books?hl=es&lr=&id=u3eHDgAAQBAJ&oi=fnd&pg=PR5&dq=mezcal+poverty+oaxaca&ots=H-2CCy_LaT&sig=45Reh0NP_IMtMt3Ev4Mn9EO7ud4,"… entangled with Oaxaca always seemed to magically cross—and Judith Romero. Oaxaca City … , some of whom I talked to extensively in Oaxaca City, was extremely helpful. These include …",I Kummels - 2017 - books.google.com,{'summary': 'I Kummels - 2017 - books.google.com'},2022-03-18 02:28:13 UTC,mezcal poverty oaxaca
Eating NAFTA,https://www.degruyter.com/document/doi/10.1525/9780520965447/html,"… priest and director of a migrant shelter in Ixtepec, Oaxaca, on a visit to New York City in May … bors saw a drop of poverty in the same period more than five times greater, an average of …",A Gálvez - 2018 - degruyter.com,"{'summary': 'A Gálvez - 2018 - degruyter.com', 'authors': [{'name': 'A Gálvez', 'link': 'https://scholar.google.com/citations?user=7-2AlVoAAAAJ&hl=es&oi=sra', 'serpapi_scholar_link': 'https://serpapi.com/search.json?author_id=7-2AlVoAAAAJ&engine=google_scholar_author&hl=es', 'author_id': '7-2AlVoAAAAJ'}]}",2022-03-18 02:28:13 UTC,mezcal poverty oaxaca
"Traditional illness, curing, and mortality: A 20-year community study in Mexico",https://search.proquest.com/openview/056eb0e93697d45d413f0605a0695724/1?pq-origsite=gscholar&cbl=18750&diss=y,"… Some basic problems encountered by Hispanics in this country stem from language, poverty, … This study was an attempt to follow in Rubel's legacy, specifically that begun in Oaxaca in …",JG Krejci - 1992 - search.proquest.com,{'summary': 'JG Krejci - 1992 - search.proquest.com'},2022-03-18 02:28:13 UTC,mezcal poverty oaxaca
Growth and insertion of small enterprises in a fragmented industry: Agency and incentive approaches,https://search.proquest.com/openview/48d8be62b76d31c3340904ffb6b50ff1/1?pq-origsite=gscholar&cbl=18750,"… In Oaxaca State, the statistics are similar to those in Latin … These SMEs in the state of Oaxaca are the main subjects of study in … an important role for economy from Oaxaca State, where it …",AT López - 2008 - search.proquest.com,{'summary': 'AT López - 2008 - search.proquest.com'},2022-03-18 02:28:13 UTC,mezcal poverty oaxaca
Working in class: Recognizing how social class shapes our academic work,https://books.google.com/books?hl=es&lr=&id=TSelCwAAQBAJ&oi=fnd&pg=PR5&dq=mezcal+poverty+oaxaca&ots=Lt9KEi-ixe&sig=LdtaQ9KdLWwzKAybOdzmDMHFRag,"… from families of privilege to teach children in poverty is the focus of chapter 9, by Michael … Enjoying a drink in a mezcal bar in Oaxaca City, I squealed with delight when I realized that …","AL Hurst, SK Nenga - 2016 - books.google.com","{'summary': 'AL Hurst, SK Nenga - 2016 - books.google.com', 'authors': [{'name': 'AL Hurst', 'link': 'https://scholar.google.com/citations?user=vTRV63sAAAAJ&hl=es&oi=sra', 'serpapi_scholar_link': 'https://serpapi.com/search.json?author_id=vTRV63sAAAAJ&engine=google_scholar_author&hl=es', 'author_id': 'vTRV63sAAAAJ'}]}",2022-03-18 02:28:13 UTC,mezcal poverty oaxaca
""" Introduction"", Indígenas mexicanos migrantes en los Estados Unidos",https://escholarship.org/content/qt6pb2j4bt/qt6pb2j4bt.pdf,"… Este evento sirve también para promover mercancías provenientes de Oaxaca (tanto artesanías como mezcal, chocolate, etcétera), traídas por empresarios que buscan ganar una …","JA Fox, G Rivera-Salgado - 2004 - escholarship.org","{'summary': 'JA Fox, G Rivera-Salgado - 2004 - escholarship.org', 'authors': [{'name': 'JA Fox', 'link': 'https://scholar.google.com/citations?user=Li6KJjgAAAAJ&hl=es&oi=sra', 'serpapi_scholar_link': 'https://serpapi.com/search.json?author_id=Li6KJjgAAAAJ&engine=google_scholar_author&hl=es', 'author_id': 'Li6KJjgAAAAJ'}, {'name': 'G Rivera-Salgado', 'link': 'https://scholar.google.com/citations?user=uiCqsdwAAAAJ&hl=es&oi=sra', 'serpapi_scholar_link': 'https://serpapi.com/search.json?author_id=uiCqsdwAAAAJ&engine=google_scholar_author&hl=es', 'author_id': 'uiCqsdwAAAAJ'}]}",2022-03-18 02:28:13 UTC,mezcal poverty oaxaca
"Passport Mexico : your pocket guide to Mexican business, customs & etiquette",https://books.google.com/books?hl=es&lr=&id=LWbhxeotZjUC&oi=fnd&pg=PP1&dq=mezcal+poverty+oaxaca&ots=9zwoo6vqxb&sig=beC61lwipT80fFbsnMPahGHyics,"… states (about 75 percent in Guerrero, Oaxaca and Chiapas). Moreover, in some areas one … 40 percent of the population living below the poverty line. According to government figures, …",R Malat - 2009 - books.google.com,{'summary': 'R Malat - 2009 - books.google.com'},2022-03-18 02:28:13 UTC,mezcal poverty oaxaca
Ambivalent journey: US migration and economic mobility in North-Central Mexico,https://books.google.com/books?hl=es&lr=&id=xSilhYla0sAC&oi=fnd&pg=PR7&dq=mezcal+poverty+oaxaca&ots=tDHF2ll2Y3&sig=YniWX-g8NKz3gZl7pa3Yz9xUz8o,"The changing political and economic relationships between Mexico and the United States, and the concurrent US debate over immigration policy and practice, demand new data on …",RC Jones - 1995 - books.google.com,{'summary': 'RC Jones - 1995 - books.google.com'},2022-03-18 02:28:13 UTC,mezcal poverty oaxaca
Enlightened immunity: Mexico's experiments with disease prevention in the Age of Reason,https://books.google.com/books?hl=es&lr=&id=Ru5qDwAAQBAJ&oi=fnd&pg=PT4&dq=mezcal+poverty+oaxaca&ots=2VRAiSDFbj&sig=OpP5sk5hdoB139iX43j6xJVDr9c,"… One such carta issued by the bishop of Oaxaca to priests and parishioners in his diocese … drink mixed with brown sugar or pineapple), mezcal (distilled agave), and others whose …",P Ramírez - 2018 - books.google.com,{'summary': 'P Ramírez - 2018 - books.google.com'},2022-03-18 02:28:13 UTC,mezcal poverty oaxaca
"6 The Regional Press Boom, ca. 1945–1965",https://books.google.com/books?hl=es&lr=&id=h950DwAAQBAJ&oi=fnd&pg=PA153&dq=mezcal+poverty+oaxaca&ots=6bb-s3ls9z&sig=1GzGl0-egyD4ExCQK47Rxi_-DHc,"… in Oaxaca alone and some twenty in Veracruz. 15 The boom … on crime, violence, and poverty. Readers knew that a … a Petatlán politician who got drunk on mezcal, refused to settle his tab…","P GILLINGHAM - Journalism, Satire, and Censorship in Mexico, 2018 - books.google.com","{'summary': 'P GILLINGHAM - Journalism, Satire, and Censorship in Mexico, 2018 - books.google.com'}",2022-03-18 02:28:13 UTC,mezcal poverty oaxaca
Foreign Travelers in Mexico,https://oxfordre.com/latinamericanhistory/view/10.1093/acrefore/9780199366439.001.0001/acrefore-9780199366439-e-525,"… In contrast, DH Lawrence found Oaxaca, a small town that … -century travelers did the same for poverty, failing to see that … A more concise study is Hacia El Paisaje del Mezcal: Viajeros …","JA Garza - Oxford Research Encyclopedia of Latin American …, 2017 - oxfordre.com","{'summary': 'JA Garza - Oxford Research Encyclopedia of Latin American …, 2017 - oxfordre.com'}",2022-03-18 02:28:13 UTC,mezcal poverty oaxaca
